{
  "protocol": 1,
  "id": "local",
  "limits": {
    "maxParticipants": 8,
    "maxMessageBytes": 8192,
    "maxMediaBytes": 4096,
    "maxExtBytes": 1024,
    "maxNameLength": 32,
    "maxClientLength": 64,
    "minRate": 0.5,
    "maxRate": 2.0,
    "maxConnections": 10000,
    "maxConnectionsPerIp": 10,
    "maxRooms": 10000,
    "maxRoomsPerIp": 3,
    "ipv6Factor56": 4,
    "ipv6Factor48": 16,
    "messageBurst": 30,
    "messagesPerSecond": 10,
    "joinBurst": 20,
    "joinsPerSecond": 1,
    "joinBurstTotal": 2000,
    "joinsPerSecondTotal": 200
  },
  "policy": {
    "stallGraceMs": 50,
    "stallReleaseMs": 40,
    "waitMs": 1500,
    "mediaWaitMs": 3000,
    "exclusionMs": 6000,
    "startDelayMinMs": 75,
    "startDelayMaxMs": 200,
    "startDelayRttFactor": 1.5,
    "defaultRttMs": 500,
    "seekCoalesceMs": 20,
    "pauseToleranceMs": 2000,
    "hostPromotionMs": 3000,
    "resumeMs": 30000,
    "maxRoomAgeMs": 8640000
  }
}
